Name,Surname,email,text
Angelica,Pace,convallis.dolor@icloud.org,"a, magna. Lorem ipsum dolor sit amet, consectetuer adipiscing elit."
Larissa,Moses,non.hendrerit.id@aol.org,"ac mattis ornare, lectus ante dictum mi, ac mattis velit"
Aileen,Wade,lorem.ipsum@icloud.couk,"vitae, orci. Phasellus dapibus quam quis diam. Pellentesque habitant morbi"
Genevieve,Riddle,accumsan.laoreet@aol.couk,"scelerisque, lorem ipsum sodales purus, in molestie tortor nibh sit"
Neil,Ball,varius.ultrices@hotmail.couk,aliquet molestie tellus. Aenean egestas hendrerit neque. In ornare sagittis
Signe,Gonzales,sed.eu@aol.com,"Etiam laoreet, libero et tristique pellentesque, tellus sem mollis dui,"
Xavier,Bush,maecenas@protonmail.couk,"Cum sociis natoque penatibus et magnis dis parturient montes, nascetur"
Vielka,Vinson,dolor.elit@aol.com,quam dignissim pharetra. Nam ac nulla. In tincidunt congue turpis.
August,Snow,eget.ipsum@hotmail.net,ornare. Fusce mollis. Duis sit amet diam eu dolor egestas
Britanney,Ball,nunc.quis@protonmail.org,"libero at auctor ullamcorper, nisl arcu iaculis enim, sit amet"
Joshua,Bean,ultrices.iaculis@hotmail.ca,"gravida sit amet, dapibus id, blandit at, nisi. Cum sociis"
Brenna,Solomon,dui.semper@aol.net,"at augue id ante dictum cursus. Nunc mauris elit, dictum"
Felicia,Reed,magnis.dis.parturient@protonmail.com,molestie. Sed id risus quis diam luctus lobortis. Class aptent
Barrett,Bates,elit.etiam@hotmail.couk,tristique neque venenatis lacus. Etiam bibendum fermentum metus. Aenean sed
Nathan,Roach,sagittis.placerat.cras@yahoo.ca,nibh sit amet orci. Ut sagittis lobortis mauris. Suspendisse aliquet
Lael,Bowers,ac.fermentum.vel@hotmail.net,Cras vulputate velit eu sem. Pellentesque ut ipsum ac mi
Anjolie,Flowers,integer.vitae@hotmail.com,non enim commodo hendrerit. Donec porttitor tellus non magna. Nam
Cecilia,Blackwell,nulla@yahoo.couk,arcu. Sed eu nibh vulputate mauris sagittis placerat. Cras dictum
Noel,Underwood,donec.feugiat@outlook.org,"tortor, dictum eu, placerat eget, venenatis a, magna. Lorem ipsum"
William,Watson,amet.risus@yahoo.com,justo. Praesent luctus. Curabitur egestas nunc sed libero. Proin sed
Aurelia,Rich,eu.nibh.vulputate@hotmail.net,"est, congue a, aliquet vel, vulputate eu, odio. Phasellus at"
Rose,Chaney,nulla@google.net,"mi. Duis risus odio, auctor vitae, aliquet nec, imperdiet nec,"
Herman,Benton,nunc@google.net,"natoque penatibus et magnis dis parturient montes, nascetur ridiculus mus."
Edan,Flowers,congue@aol.net,et malesuada fames ac turpis egestas. Aliquam fringilla cursus purus.
Rana,Simpson,ultricies.adipiscing@yahoo.couk,augue ac ipsum. Phasellus vitae mauris sit amet lorem semper
Tad,Holden,eu@google.com,"vel, vulputate eu, odio. Phasellus at augue id ante dictum"
Bruce,Lyons,a@yahoo.com,"a purus. Duis elementum, dui quis accumsan convallis, ante lectus"
Harper,Franklin,ut.nulla.cras@protonmail.com,"Donec nibh enim, gravida sit amet, dapibus id, blandit at,"
Kay,Ramos,accumsan@outlook.edu,"luctus ut, pellentesque eget, dictum placerat, augue. Sed molestie. Sed"
Oprah,Roy,et@outlook.net,"Mauris vel turpis. Aliquam adipiscing lobortis risus. In mi pede,"
Karleigh,Burns,pharetra@hotmail.couk,a mi fringilla mi lacinia mattis. Integer eu lacus. Quisque
Margaret,Shepherd,id.nunc.interdum@google.net,"vitae, erat. Vivamus nisi. Mauris nulla. Integer urna. Vivamus molestie"
Basil,Avery,cum@hotmail.edu,"sit amet, dapibus id, blandit at, nisi. Cum sociis natoque"
Hammett,Noel,eros.turpis@protonmail.edu,"neque. In ornare sagittis felis. Donec tempor, est ac mattis"
Willa,Cardenas,sem.pellentesque@yahoo.ca,mauris blandit mattis. Cras eget nisi dictum augue malesuada malesuada.
Allen,Blackwell,montes.nascetur@protonmail.edu,odio sagittis semper. Nam tempor diam dictum sapien. Aenean massa.
Chanda,Bush,sed.libero@outlook.couk,"Aliquam nec enim. Nunc ut erat. Sed nunc est, mollis"
Axel,Peterson,ornare@yahoo.net,dolor. Quisque tincidunt pede ac urna. Ut tincidunt vehicula risus.
Ifeoma,Strickland,donec.at@protonmail.com,"Cras dictum ultricies ligula. Nullam enim. Sed nulla ante, iaculis"
Reese,Ware,ac.tellus.suspendisse@hotmail.org,"eget, venenatis a, magna. Lorem ipsum dolor sit amet, consectetuer"
Jakeem,Shepard,et@yahoo.ca,"nibh. Donec est mauris, rhoncus id, mollis nec, cursus a,"
Raymond,Stokes,vestibulum@google.edu,"magnis dis parturient montes, nascetur ridiculus mus. Proin vel nisl."
Cameron,Raymond,nulla@aol.couk,"scelerisque, lorem ipsum sodales purus, in molestie tortor nibh sit"
Raja,Cash,non@yahoo.edu,nisl. Quisque fringilla euismod enim. Etiam gravida molestie arcu. Sed
Aphrodite,Clay,luctus@yahoo.edu,"et arcu imperdiet ullamcorper. Duis at lacus. Quisque purus sapien,"
Ali,Ayala,netus.et.malesuada@aol.couk,"nec tempus scelerisque, lorem ipsum sodales purus, in molestie tortor"
Drake,Wagner,iaculis.odio@aol.ca,tellus. Aenean egestas hendrerit neque. In ornare sagittis felis. Donec
Christine,Simmons,eu.augue@aol.couk,gravida molestie arcu. Sed eu nibh vulputate mauris sagittis placerat.
Tasha,Jones,integer@outlook.com,nisl. Maecenas malesuada fringilla est. Mauris eu turpis. Nulla aliquet.
Camilla,Gamble,ridiculus.mus.donec@hotmail.net,Suspendisse tristique neque venenatis lacus. Etiam bibendum fermentum metus. Aenean
Palmer,Cole,mauris.quis@hotmail.org,consequat dolor vitae dolor. Donec fringilla. Donec feugiat metus sit
Jesse,Carpenter,taciti@hotmail.com,"Nunc sed orci lobortis augue scelerisque mollis. Phasellus libero mauris,"
Lila,Vang,dapibus.gravida@google.edu,eu dui. Cum sociis natoque penatibus et magnis dis parturient
Xaviera,Townsend,nec@hotmail.com,"ac, eleifend vitae, erat. Vivamus nisi. Mauris nulla. Integer urna."
Keaton,Rodriquez,fusce.aliquet.magna@icloud.edu,orci. Ut semper pretium neque. Morbi quis urna. Nunc quis
Christopher,Gates,praesent@aol.com,"ac, fermentum vel, mauris. Integer sem elit, pharetra ut, pharetra"
Knox,Keller,arcu@google.org,"fringilla, porttitor vulputate, posuere vulputate, lacus. Cras interdum. Nunc sollicitudin"
Declan,Stone,rutrum.magna@google.couk,"sem semper erat, in consectetuer ipsum nunc id enim. Curabitur"
Ulla,White,sapien.nunc.pulvinar@yahoo.net,eu tellus eu augue porttitor interdum. Sed auctor odio a
Faith,Cote,in.sodales.elit@icloud.ca,"mauris, rhoncus id, mollis nec, cursus a, enim. Suspendisse aliquet,"
Zenaida,Hurst,enim.nisl.elementum@aol.com,ultrices. Duis volutpat nunc sit amet metus. Aliquam erat volutpat.
Stephen,Lamb,et.magnis@protonmail.com,"Duis elementum, dui quis accumsan convallis, ante lectus convallis est,"
Kathleen,Townsend,elit.pretium@protonmail.ca,"risus. Quisque libero lacus, varius et, euismod et, commodo at,"
Carter,Mccarthy,magna.nec@outlook.edu,pharetra. Quisque ac libero nec ligula consectetuer rhoncus. Nullam velit
Xandra,Walton,pede@hotmail.couk,"Etiam laoreet, libero et tristique pellentesque, tellus sem mollis dui,"
Jonah,Weaver,quisque.ornare.tortor@outlook.com,Sed dictum. Proin eget odio. Aliquam vulputate ullamcorper magna. Sed
Kennedy,Rivas,a.malesuada@aol.couk,"tincidunt adipiscing. Mauris molestie pharetra nibh. Aliquam ornare, libero at"
Phelan,Gutierrez,id.erat.etiam@icloud.couk,"penatibus et magnis dis parturient montes, nascetur ridiculus mus. Aenean"
Aquila,Harrington,odio.etiam@hotmail.org,"arcu iaculis enim, sit amet ornare lectus justo eu arcu."
Aiko,Mcleod,eget.lacus@icloud.couk,"amet massa. Quisque porttitor eros nec tellus. Nunc lectus pede,"
Kasimir,Duncan,ipsum.non@yahoo.edu,sed pede. Cum sociis natoque penatibus et magnis dis parturient
Ross,Cochran,id.ante@yahoo.org,blandit congue. In scelerisque scelerisque dui. Suspendisse ac metus vitae
Simone,Bender,eu.metus@hotmail.org,"tellus lorem eu metus. In lorem. Donec elementum, lorem ut"
Channing,Munoz,dolor.vitae.dolor@hotmail.edu,"lectus. Cum sociis natoque penatibus et magnis dis parturient montes,"
MacKenzie,Daugherty,egestas.rhoncus.proin@yahoo.couk,nisi. Aenean eget metus. In nec orci. Donec nibh. Quisque
Jakeem,Rojas,adipiscing.mauris@protonmail.couk,Morbi vehicula. Pellentesque tincidunt tempus risus. Donec egestas. Duis ac
Mari,Travis,ornare.lectus@hotmail.couk,"eget, volutpat ornare, facilisis eget, ipsum. Donec sollicitudin adipiscing ligula."
Barrett,Miles,ultricies.sem.magna@google.couk,luctus et ultrices posuere cubilia Curae Phasellus ornare. Fusce mollis.
Abdul,Miller,eget@outlook.net,"venenatis vel, faucibus id, libero. Donec consectetuer mauris id sapien."
Charles,Clark,congue@icloud.ca,feugiat placerat velit. Quisque varius. Nam porttitor scelerisque neque. Nullam
Deanna,Gaines,tempor.bibendum@google.com,In at pede. Cras vulputate velit eu sem. Pellentesque ut
Gillian,Ayers,ipsum.sodales@aol.org,"mauris, rhoncus id, mollis nec, cursus a, enim. Suspendisse aliquet,"
Erin,Dominguez,egestas.aliquam.fringilla@google.com,"Lorem ipsum dolor sit amet, consectetuer adipiscing elit. Etiam laoreet,"
Kasper,Castaneda,nonummy.ut@google.edu,orci luctus et ultrices posuere cubilia Curae Donec tincidunt. Donec
Jasper,Watts,mi@icloud.org,"id sapien. Cras dolor dolor, tempus non, lacinia at, iaculis"
Brielle,Estrada,massa.quisque.porttitor@hotmail.net,ornare lectus justo eu arcu. Morbi sit amet massa. Quisque
Whoopi,Lott,diam@hotmail.com,ligula. Aenean gravida nunc sed pede. Cum sociis natoque penatibus
Xyla,Maddox,neque.non.quam@outlook.net,"facilisis facilisis, magna tellus faucibus leo, in lobortis tellus justo"
Hakeem,Savage,curabitur.ut.odio@protonmail.edu,"lorem, eget mollis lectus pede et risus. Quisque libero lacus,"
Kyra,Mosley,condimentum.eget@protonmail.net,amet nulla. Donec non justo. Proin non massa non ante
Fallon,Olson,est.ac@google.couk,"Cras dictum ultricies ligula. Nullam enim. Sed nulla ante, iaculis"
Ivan,Shaw,sit.amet@aol.net,In at pede. Cras vulputate velit eu sem. Pellentesque ut
Ezra,Case,a.magna.lorem@aol.edu,"luctus sit amet, faucibus ut, nulla. Cras eu tellus eu"
Henry,Crane,vel@aol.couk,eros. Proin ultrices. Duis volutpat nunc sit amet metus. Aliquam
Skyler,Sawyer,orci.lobortis@aol.org,erat volutpat. Nulla facilisis. Suspendisse commodo tincidunt nibh. Phasellus nulla.
Amber,Lane,vehicula.aliquet.libero@yahoo.edu,"quis, tristique ac, eleifend vitae, erat. Vivamus nisi. Mauris nulla."
Tucker,Montoya,ut.dolor.dapibus@outlook.net,arcu. Aliquam ultrices iaculis odio. Nam interdum enim non nisi.
Selma,Valentine,mauris.elit@yahoo.edu,dapibus quam quis diam. Pellentesque habitant morbi tristique senectus et
Britanni,Ewing,velit.dui@hotmail.com,"egestas, urna justo faucibus lectus, a sollicitudin orci sem eget"
Owen,Rodgers,facilisis.suspendisse@protonmail.org,"et risus. Quisque libero lacus, varius et, euismod et, commodo"
